text,Jonathan,Michael,Corpus
"ve in order to stop more regulation and required transparency . We love hearing from you . So please <keep sending us your> e-mails and response through "" Cutting Through the Bull "" and pretty much anything else on the show , and we will try to get them on the air when we",iterative,iterative,A
"st . You used to write for Howard stern . : Oh , boy . : What happened ? : Well , in radio my bosses <kept getting younger and> dumber . : By this point it was clear I was n't catching anything . Steve put a stunt fish on my line so I could find out what it feels like . : OK ,",iterative,iterative,A
"pothermia was setting in . I -- I just did nt know how bad it was at that time -- : Right . : -- and <kept going . :> You get there . You get a hold of the ladder . Almost too exhausted to even climb up , you get inside -- : Yeah . : -- and what was the reaction to t",continuative,continuative,A
". : -- we had Transformers -- : Mm-Hm. : -- so this is the Accelerator Joe- : Oh . : -- and we just <keep doing this- :> Okay . : -- and he does all kinds of things . And he just keeps going his legs . : Cool , cool , All right . : Transformers. : All right . And this i",ambiguous,continuative,A
"cortex ? I think it really has to do with patterns of your brain . And what you really need to do is <keep pushing your brain> . It 's not a conscious thing . I think that if we try to focus really hard on something , that 's calling on our frontal cortex . If we learn someth",iterative,continuative,A
"solve this problem . If those levels get a whole lot higher , can they really stay in that plant and <keep trying to cool> it down ? And what happen if they have to evacuate ? It 's a terrible scenario to think about . : It 's extraordinarily heroic of them to be doing it",ambiguous,iterative,A
"ly , really sad moment . When the day come , we sat -- me and my sister were crying like we did , we <kept hugging him ,> and we did n't want him to go , so it 's really sad with me. We brought him to the airport and everything and then like , we were , too -- like we we",continuative,ambiguous ,A
"... and saying , ' I 'm here , I 'm here , follow my voice back . I 'm here to help you . And I just <kept stroking her arm> . I did n't care if it was silly . I did n't care if it was stupid . I was going to do something . By now Beverly had realized that her friend Kirby",iterative,iterative,A
"self and somewhat controversial at the time . But they almost universally panned it , and yet crowds <kept coming . That> 's -- that 's right , Jeff . I mean , you ca n't underestimate the interest that a lot of Americans and a lot of tourists have in Spider-Man . Spider",iterative,ambiguous ,A